Paul Ekman,Tweets Limpos
tristeza,triste mamÃe tomou vacina tendo efeitos ruins bichinha passou noite toda tremendo febrâ httpstcoUBVY0pQCwU
medo,horas ansiedade deixa falta parece morrer
raiva,crise ansiedade falta crlho
tristeza,acordar falta pior coisa
raiva,caralho todo falta
raiva,odeio falta passa nada volta
raiva,falta nada odio
raiva,falta cacete
raiva,bosta desse tosse dsgcd paÃxadsda risada lixo humano merece respeito httpstco86853HjnFb
medo,acordou tossindo horrores achando tava COVID Desliguei instantaneamenteâ httpstcoF52GBXN3yV
raiva,semana tosse merda tomar
tristeza,Crise tosse nenÃm hora consigo dormir
raiva,hmmmm delÃxadcia garganta tosse febre ESPERO MORRA
raiva,tosse chata afff
raiva,inferno tosse junto garganta inflamada
raiva,Rinite tosse deixa dormir nada
raiva,Contra tudo vocÃ disse principais coisas feitas chutar vocÃ siensia paraâ httpstcoRv3qdgDMLO
raiva,Fica casa morrer falta Genocida
raiva,Nunca esquecer cure centro medico falta VocÃ contribui indiretaâ httpstco6pdJN524TF
raiva,Olha vagabundo dizia curar hospital somente caso falta jurava httpstco1xZpKhdJ6H
raiva,seguir tocolo curar ajuda mÃdica falta httpstcojSBBbMCJld
raiva,coragem chamar alguÃm charlao KkkkkkkkkknCom certeza vacina serÃ melhor httpstcoKxHdM2Qojb
raiva,VocÃ responvel milhares mortes infectados âFique Casaâx9d hospital quandoâ httpstcoMZ5UQIOnhg
raiva,parabenizando ministro orientou pessoas curarem auxÃxadlio httpstcoQKUzWxwU65
raiva,vamos tentarficar casa esperando sentir falta hospital morrerfico
raiva,ximo aniverrio tocolo genocida Mandetta Fique casa curâ httpstcobfNn61X5Yt
raiva,Dudu sacanagem cara heim febre hospitais campanha ocupaÃÃo baixâ httpstcozZYSZwgUvn
tristeza,inÃxadcio pandemia comprei cookies padaria mordida seguida comâ httpstcoytBXryPO3c
tristeza,febre dores passar madrugada acordado apenas tentando cochilar causa corpo super quenâ httpstcoFgvPTmCvA6
tristeza,noite toda queimando febre Agarrado x8fu200¸x8f
raiva,acordei febre ÃDIO
tristeza,Acordei Arthur febre nada
tristeza,diiiianTo melhor febre dias amÃm senhornTriste tudo vivendo preocupada httpstcoeVV9FhPduQ
tristeza,Cochilei acordei queimando febre senhor aguentar tudo acontecendo nxad
tristeza,acho febre aaaaah
tristeza,queimado febre
tristeza,febre noite toda DEUS queria dormir direto
tristeza,febre vezes consigo ficar amamentaÃÃo nada facil vontade desistir
raiva,Luiz febre desde terÃa cara
tristeza,aguento todo ficar febre
tristeza,Odeio filho febre dois dias seguidos odeio amuadinho choro queria tirar tudo pega
raiva,olha hora febre cara puta pariu toma
raiva,febre chataaaaa
tristeza,queimando febre noite toda deus
tristeza,virei noite vendo novela enquanto chorava conta febre odeio
raiva,deus falta FESTA muvuca calor suor open cheirÃo maconha Ãdio covid pagaaaa
tristeza,ansiedade atacada falta comeÃo tremer serio caralho
tristeza,passando lidar coisas lidar humano morrer falta
tristeza,vazio grande falta
tristeza,fiquei falta tanto chorar
raiva,2020 mandetta mandando ficar casa sentir falta precisar respirador CARÃx8 httpstcoQWwe4SypBR
medo,quantos pasis comeu kkkk ansiosa falta fico medo covid
tristeza,dando falta novo noite dormir
tristeza,ansiedade pÃnico covidnnPÃnico crise pÃssima chorei falta tosse pioraramnnAnsieda httpstcolOwJ4tb0vE
medo,falta matar
surpresa,comecei tremer ficar falta nada
medo,algo fico falta meudeus
medo,jesus falta
tristeza,amiga covid sentindo muita falta Ficamos telefone esperando ambulÃncia buscar
felicidade,falta fudida menos passei vergonha aÃxad caralho foda
raiva,hospital somente falta Lixo httpstco4uwrpqDGbx
surpresa,queimando febre nada
raiva,legal morar respeita isolamento pigarreiatosse casa
tristeza,Poxa falar olha acordei tosse seca respirar tiro queda
tristeza,agora verdade peguei fraco cansaÃo tosse agora sentirâ httpstcoYuSZcIuAMp
medo,Medo ouvir tosse medo precisar bando arrombâ httpstcoqVw780ZTGr
raiva,tosse seca chata fudida desde
raiva,Bosta tosse caralho
medo,Cada tosse bate desespero cansada demais desse medo cara
medo,Caio febre ontem hoje febril noite tosse Jesus morro medo
tristeza,ComeÃou tossecoceirannEU AGUENTO MAIIIISSSS
raiva,Mano tosse chata
medo,Nariz ardendo coriza tosse espirros cara drogada nSou nesse momento rezando covid novo
surpresa,tosse misericÃrdia
raiva,tosse infenro
medo,tosse eita porr
medo,tosse estranha espirrando Medo
raiva,Tosse capeta
tristeza,consigo parar chorar falta
tristeza,falta peito quero chorar
medo,covid preocupa tanto fico pavor falta outros sentem toda vida questionandoâ httpstcoNv8CR3GIOw
tristeza,sentimento ruim angÃstia caralho falta
felicidade,posso malhar corona tendo sintomas kkkkkkk aÃxad falta httpstcoOQ8porlfX7
raiva,Hora porra falta
tristeza,aguento crises falta peito
tristeza,madrugada enquanto dormindo tranquilos chorando falta
tristeza,aguento falta
surpresa,falta
raiva,falta CARALHO
raiva,falta inferno
raiva,falta krlh
surpresa,falta peito
raiva,Sentindo falta vtmnc
felicidade,crise tosse alÃrgica hora levantou nada remÃdio narural demais
raiva,tosse alÃrgica saco povo acha covid
tristeza,tosse seca deve falta lÃxadquido
tristeza,tosse capta Deus quero dormir
surpresa,Apareceu tosse seca
raiva,agora dormir crise tosse desgraÃadaa
medo,respiraÃÃo oscilando corpo veio calafrio leve tosse garganta estranha apenas pedindo morr
tristeza,tosse deixa bebÃ dormi
raiva,queria dormir tosse impede
medo,chegou trouxe crise tosse espero tomou chuva hoje
raiva,tosse chata crlh
tristeza,vendo raiar acordada ainda bichinho tosse
medo,medo tosse
raiva,Tosse chata
raiva,Tosse
raiva,Tosse maldita
raiva,Tudo envolve mulher gravidez Tava conversando dizendo algo errado meuâ httpstcoM4qHX1rOwX
surpresa,Caraca muita febre
raiva,febre acabou falta desgraÃa passa
tristeza,triste trabalhar deixa filho febre criar filho sozinha fÃcil Deus ajudar
raiva,Gilberto mande tomar vocÃ ficou noite toda apoiando medindo febre cuidando pessoa tratando feito lixo
tristeza,Pedro acordou enjoadinho febre
surpresa,febre esssa passa
raiva,triste demais situaÃÃo escola quele caso falei Ãxadrrita httpstcorAlT4PxCZe
surpresa,tosse Camilla sara nÃnMisericÃrdia
nojo,todo mundo tosse capeta nessa credo
surpresa,gente âtosse tosseâx9d Socorro
surpresa,tanto povo tosse nessa casa kkkk BBB21
tristeza,tosse atacando nada causa gripe tava
tristeza,cara tosse contagiosa geral assim
felicidade,agora anjo tosse outros sintomas pesados embora
raiva,dias semana meia tosse garganta inferno
raiva,agora inferno tosse faltava
tristeza,cansada entupir remÃdio tosse precisa acabar
raiva,fico puta alguÃm ESTUDOU MEDICINA recomenda remÃdio vezes outro httpstcowbiMJMAgDT
tristeza,anos corpo muita tosse garganta doendo agora comeÃou falta conâ httpstcormPNNTI5Wc
felicidade,fofinha chegou acordou tomar melhorar tosse melhor
surpresa,tosse cachorro
felicidade,Relario covid isolamento coloquei serie comecei livro receitas reinventando praâ httpstco7xUM8uCZiY
tristeza,febre tosse cansaÃo dores corpo perda paladar teste infelizmente covid19
raiva,tosse inferno
tristeza,arrependo amargamente pegue toda falta volta pufavo imploro
medo,falta mataâx9d EKKSKSKSKW guria casinha
raiva,assiste vÃxaddeo reportagem sente nenhum pouco Ãdio presidente governo MÃx8dNIâ httpstcokmpD0hpJO6
tristeza,momento vocÃ falta nada doenÃaÃ dentro sabe Vontade chorarsumir nada
tristeza,psicolÃgico foda Tava vendo maria fanstico sobre covid comecei ficar ansiosaâ httpstcowQUaVqvlrt
tristeza,pior crise ansiedade falta senhor
medo,falta vontade chorar causa ansiedade sensaÃÃo algo ruim acontecer
raiva,Mandeta NinguÃm esqueceu recomendaÃÃo pessoas curassem hospital estiâ httpstcohVLpAdEUWF
raiva,Acrescento GENOCIDA nega tratamento ainda fique casa sentir falta
tristeza,Amiga passou manha falta atendida resistiu Infartou
medo,aÃxad deus acho falta
tristeza,elogiou risada parece atropelado falta
tristeza,falta desespero tristeza raiva frustraÃÃo depreso denimo vontade quÃxadmica tristeza solio httpstco757lnanf4y
raiva,Falta caralho
raiva,falta ¬¯¯¨
tristeza,falar onde tirar forÃa viver semana desabei chorando falta httpstco9OLt4QLJMg
tristeza,pior vida tanta falta achei morrer
surpresa,mano falando RECEPCIONISTA doutor falta sabeâx9d meudeus
medo,covid sentindo muita falta ficar casa vaga nenhum hospital totalmente desesperador
medo,aperto falta arum desesperopensei nunca crises
raiva,falta desgraÃada
felicidade,melhorou Investiga febre sinal alguma coisa errada
felicidade,lida febre 38ÂC KKKKKKKKKKKK
tristeza,febre sinceramente aguentar mano quero chorar puta pariu
tristeza,Febre embora
tristeza,frio febre gostoso literalmente morrer
tristeza,Kevin queimando febre Deus precisa muita forÃa aguento filho assim
raiva,frio caralho acho febre Preciso banheiro disse consigo sair debaixo cobertas
medo,Saiu casa chego casa pouco febre tremendo todo nnnto agora fudeu
tristeza,febre acabando
raiva,conseguindo levantar cama queimando febre odiooooookoooo
tristeza,febre fudida
tristeza,falarser filhos imunidade baixa foda qualquer coisinha ficam doente thalleâ httpstcomlfff6f2Hf
raiva,colega trabalho loja bado conjuntiviteapareceu manhÃ tambÃm convidado httpstcoikr49O2DrO
raiva,china culpa assim Brasil httpstcoXTx8dQxY2W
