Polaridade,Tweets Limpos
neutro,meses esperando cirurgia Sofia hoje bichinha iria operar acorda febre tomara httpstco8XkuzUTvSY
negativo,febre Deus corre aqui
neutro,BebÃ febre
negativo,acordado desde febre fudida
neutro,Bryan febre aqui agarrada vendo desenho
negativo,reuniÃo sensaÃÃo estar febre serÃ covid apenas RAIVA
positivo,graÃas deus hoje acordei febre tomei remÃdio ontem acordei melhor marcar fazer teste
neutro,Leonan agarrado sentindo febre direto tadinho
positivo,febre baixou bastante sentindo garganta finalmente
negativo,FEBRE BAIXOU QRIA PRESENCIAL MANO mami academia merda
negativo,passar madrugada inteira febre
neutro,favor febre
negativo,Ãdio mano febre garganta doendo acorda fazer cafÃ cara sendo pode fazer
neutro,febre Deus
negativo,quase manhÃ desespero crianÃa queimando febre deitada barriga
neutro,Susto gota vindo madrugada febre
neutro,queimando febre posxadvel mano
neutro,febre noite toda Deus ajude
negativo,puta febre literalmente nada fico febre
positivo,braÃo vacina febre leve noite nunca fiquei feliz sentir kkkkkknObriga httpstcoX80QBxo5hv
negativo,triste mamÃe tomou vacina tendo efeitos ruins bichinha passou noite toda tremendo febrâ httpstcoUBVY0pQCwU
negativo,horas ansiedade deixa falta parece morrer
negativo,crise ansiedade falta crlho
negativo,acordar falta pior coisa
negativo,caralho todo falta
negativo,odeio falta passa nada volta
negativo,falta nada odio
negativo,falta cacete
negativo,bosta desse tosse dsgcd paÃxadsda risada lixo humano merece respeito httpstco86853HjnFb
neutro,acordou tossindo horrores achando tava COVID Desliguei instantaneamenteâ httpstcoF52GBXN3yV
negativo,semana tosse merda tomar
neutro,Crise tosse nenÃm hora consigo dormir
negativo,hmmmm delÃxadcia garganta tosse febre ESPERO MORRA
negativo,tosse chata afff
negativo,inferno tosse junto garganta inflamada
negativo,Rinite tosse deixa dormir nada
negativo,Contra tudo vocÃ disse principais coisas feitas chutar vocÃ siensia paraâ httpstcoRv3qdgDMLO
negativo,Fica casa morrer falta Genocida
negativo,Nunca esquecer cure centro medico falta VocÃ contribui indiretaâ httpstco6pdJN524TF
negativo,Olha vagabundo dizia curar hospital somente caso falta jurava httpstco1xZpKhdJ6H
negativo,seguir tocolo curar ajuda mÃdica falta httpstcojSBBbMCJld
negativo,coragem chamar alguÃm charlao KkkkkkkkkknCom certeza vacina serÃ melhor httpstcoKxHdM2Qojb
negativo,VocÃ responvel milhares mortes infectados âFique Casaâx9d hospital quandoâ httpstcoMZ5UQIOnhg
negativo,parabenizando ministro orientou pessoas curarem auxÃxadlio httpstcoQKUzWxwU65
negativo,vamos tentarficar casa esperando sentir falta hospital morrerfico
negativo,ximo aniverrio tocolo genocida Mandetta Fique casa curâ httpstcobfNn61X5Yt
negativo,Dudu sacanagem cara heim febre hospitais campanha ocupaÃÃo baixâ httpstcozZYSZwgUvn
negativo,inÃxadcio pandemia comprei cookies padaria mordida seguida comâ httpstcoytBXryPO3c
negativo,febre dores passar madrugada acordado apenas tentando cochilar causa corpo super quenâ httpstcoFgvPTmCvA6
neutro,noite toda queimando febre Agarrado x8fu200¸x8f
negativo,acordei febre ÃDIO
neutro,Acordei Arthur febre nada
positivo,diiiianTo melhor febre dias amÃm senhornTriste tudo vivendo preocupada httpstcoeVV9FhPduQ
negativo,Cochilei acordei queimando febre senhor aguentar tudo acontecendo nxad
neutro,acho febre aaaaah
negativo,queimado febre
negativo,febre noite toda DEUS queria dormir direto
negativo,febre vezes consigo ficar amamentaÃÃo nada facil vontade desistir
neutro,Luiz febre desde terÃa cara
negativo,aguento todo ficar febre
negativo,Odeio filho febre dois dias seguidos odeio amuadinho choro queria tirar tudo pega
negativo,olha hora febre cara puta pariu toma
negativo,febre chataaaaa
negativo,queimando febre noite toda deus
negativo,virei noite vendo novela enquanto chorava conta febre odeio
neutro,deus falta FESTA muvuca calor suor open cheirÃo maconha Ãdio covid pagaaaa
negativo,ansiedade atacada falta comeÃo tremer serio caralho
negativo,passando lidar coisas lidar humano morrer falta
negativo,vazio grande falta
negativo,fiquei falta tanto chorar
negativo,2020 mandetta mandando ficar casa sentir falta precisar respirador CARÃx8 httpstcoQWwe4SypBR
negativo,quantos pasis comeu kkkk ansiosa falta fico medo covid
neutro,dando falta novo noite dormir
negativo,ansiedade pÃnico covidnnPÃnico crise pÃssima chorei falta tosse pioraramnnAnsieda httpstcolOwJ4tb0vE
negativo,falta matar
neutro,comecei tremer ficar falta nada
neutro,algo fico falta meudeus
neutro,jesus falta
neutro,amiga covid sentindo muita falta Ficamos telefone esperando ambulÃncia buscar
positivo,falta fudida menos passei vergonha aÃxad caralho foda
negativo,hospital somente falta Lixo httpstco4uwrpqDGbx
neutro,queimando febre nada
negativo,legal morar respeita isolamento pigarreiatosse casa
neutro,Poxa falar olha acordei tosse seca respirar tiro queda
neutro,agora verdade peguei fraco cansaÃo tosse agora sentirâ httpstcoYuSZcIuAMp
negativo,Medo ouvir tosse medo precisar bando arrombâ httpstcoqVw780ZTGr
negativo,tosse seca chata fudida desde
negativo,Bosta tosse caralho
negativo,Cada tosse bate desespero cansada demais desse medo cara
negativo,Caio febre ontem hoje febril noite tosse Jesus morro medo
negativo,ComeÃou tossecoceirannEU AGUENTO MAIIIISSSS
negativo,Mano tosse chata
neutro,Nariz ardendo coriza tosse espirros cara drogada nSou nesse momento rezando covid novo
neutro,tosse misericÃrdia
negativo,tosse infenro
neutro,tosse eita porr
neutro,tosse estranha espirrando Medo
neutro,Tosse capeta
negativo,consigo parar chorar falta
negativo,falta peito quero chorar
negativo,covid preocupa tanto fico pavor falta outros sentem toda vida questionandoâ httpstcoNv8CR3GIOw
negativo,sentimento ruim angÃstia caralho falta
neutro,posso malhar corona tendo sintomas kkkkkkk aÃxad falta httpstcoOQ8porlfX7
negativo,Hora porra falta
negativo,aguento crises falta peito
negativo,madrugada enquanto dormindo tranquilos chorando falta
negativo,aguento falta
neutro,falta
negativo,falta CARALHO
negativo,falta inferno
negativo,falta krlh
neutro,falta peito
negativo,Sentindo falta vtmnc
positivo,crise tosse alÃrgica hora levantou nada remÃdio narural demais
negativo,tosse alÃrgica saco povo acha covid
neutro,tosse seca deve falta lÃxadquido
negativo,tosse capta Deus quero dormir
neutro,Apareceu tosse seca
negativo,agora dormir crise tosse desgraÃadaa
neutro,respiraÃÃo oscilando corpo veio calafrio leve tosse garganta estranha apenas pedindo morr
negativo,tosse deixa bebÃ dormi
negativo,queria dormir tosse impede
neutro,chegou trouxe crise tosse espero tomou chuva hoje
negativo,tosse chata crlh
neutro,vendo raiar acordada ainda bichinho tosse
negativo,medo tosse
negativo,Tosse chata
negativo,Tosse
negativo,Tosse maldita
negativo,Tudo envolve mulher gravidez Tava conversando dizendo algo errado meuâ httpstcoM4qHX1rOwX
neutro,Caraca muita febre
negativo,febre acabou falta desgraÃa passa
negativo,triste trabalhar deixa filho febre criar filho sozinha fÃcil Deus ajudar
negativo,Gilberto mande tomar vocÃ ficou noite toda apoiando medindo febre cuidando pessoa tratando feito lixo
neutro,Pedro acordou enjoadinho febre
neutro,febre esssa passa
negativo,triste demais situaÃÃo escola quele caso falei Ãxadrrita httpstcorAlT4PxCZe
negativo,tosse Camilla sara nÃnMisericÃrdia
negativo,todo mundo tosse capeta nessa credo
neutro,gente âtosse tosseâx9d Socorro
neutro,tanto povo tosse nessa casa kkkk BBB21
neutro,tosse atacando nada causa gripe tava
neutro,cara tosse contagiosa geral assim
positivo,agora anjo tosse outros sintomas pesados embora
negativo,dias semana meia tosse garganta inferno
negativo,agora inferno tosse faltava
negativo,cansada entupir remÃdio tosse precisa acabar
negativo,fico puta alguÃm ESTUDOU MEDICINA recomenda remÃdio vezes outro httpstcowbiMJMAgDT
negativo,anos corpo muita tosse garganta doendo agora comeÃou falta conâ httpstcormPNNTI5Wc
positivo,fofinha chegou acordou tomar melhorar tosse melhor
neutro,tosse cachorro
positivo,Relario covid isolamento coloquei serie comecei livro receitas reinventando praâ httpstco7xUM8uCZiY
negativo,febre tosse cansaÃo dores corpo perda paladar teste infelizmente covid19
negativo,tosse inferno
negativo,arrependo amargamente pegue toda falta volta pufavo imploro
negativo,falta mataâx9d EKKSKSKSKW guria casinha
negativo,assiste vÃxaddeo reportagem sente nenhum pouco Ãdio presidente governo MÃx8dNIâ httpstcokmpD0hpJO6
negativo,momento vocÃ falta nada doenÃaÃ dentro sabe Vontade chorarsumir nada
negativo,psicolÃgico foda Tava vendo maria fanstico sobre covid comecei ficar ansiosaâ httpstcowQUaVqvlrt
negativo,pior crise ansiedade falta senhor
negativo,falta vontade chorar causa ansiedade sensaÃÃo algo ruim acontecer
negativo,Mandeta NinguÃm esqueceu recomendaÃÃo pessoas curassem hospital estiâ httpstcohVLpAdEUWF
negativo,Acrescento GENOCIDA nega tratamento ainda fique casa sentir falta
negativo,Amiga passou manha falta atendida resistiu Infartou
negativo,aÃxad deus acho falta
negativo,elogiou risada parece atropelado falta
negativo,falta desespero tristeza raiva frustraÃÃo depreso denimo vontade quÃxadmica tristeza solio httpstco757lnanf4y
negativo,Falta caralho
negativo,falta ¬¯¯¨
negativo,falar onde tirar forÃa viver semana desabei chorando falta httpstco9OLt4QLJMg
negativo,pior vida tanta falta achei morrer
neutro,mano falando RECEPCIONISTA doutor falta sabeâx9d meudeus
negativo,covid sentindo muita falta ficar casa vaga nenhum hospital totalmente desesperador
negativo,aperto falta arum desesperopensei nunca crises
negativo,falta desgraÃada
positivo,melhorou Investiga febre sinal alguma coisa errada
neutro,lida febre 38ÂC KKKKKKKKKKKK
negativo,febre sinceramente aguentar mano quero chorar puta pariu
neutro,Febre embora
negativo,frio febre gostoso literalmente morrer
negativo,Kevin queimando febre Deus precisa muita forÃa aguento filho assim
negativo,frio caralho acho febre Preciso banheiro disse consigo sair debaixo cobertas
negativo,Saiu casa chego casa pouco febre tremendo todo nnnto agora fudeu
negativo,febre acabando
negativo,conseguindo levantar cama queimando febre odiooooookoooo
negativo,febre fudida
neutro,falarser filhos imunidade baixa foda qualquer coisinha ficam doente thalleâ httpstcomlfff6f2Hf
negativo,colega trabalho loja bado conjuntiviteapareceu manhÃ tambÃm convidado httpstcoikr49O2DrO
negativo,china culpa assim Brasil httpstcoXTx8dQxY2W
