Polaridade,Tweets Limpos
neutro,benalet salva garganta acaba tosse implorando POSSO ficar doente
negativo,caralho queria tosse embora deus perturbaÃÃo
negativo,garganta Deus doer junta tosse cachorro ninguÃm merece U0001f97aU0001f97aU0001f97aU0001f97a
neutro,difÃxadcil povo ruim todos sintomas covid covid âuma gripe forteâx9d diarreia httpstcormoivvrn5b
positivo,noite Bernardo quer tosse dormiu super tranquilonGraÃas Deus
negativo,tosse atrapalhando soninho
negativo,tosse acabando sentindo sendo afogada ventilador tava parado comeÃouâ httpstcoEheOBp7aGj
negativo,tosse assustando medo piripaque
negativo,tosse caralhooo Ãdio aguento
neutro,achando bizarrroooo monte conhecido amigas familiares ZUADOS todos sintomas covid httpstcoBEn5Ov4nE3
neutro,prima falando coronÃria enquanto tosse kkkk
negativo,ODIO COMEÃO CRISE TOSSE NADA
negativo,tosse insuporvel difÃxadcil dormir assim
neutro,sempre horas tosse ataca incrÃxadvel
negativo,aqui filho colo porque tosse chata deixa dormir
negativo,tosse chata
negativo,Tosse chata porra
negativo,tosse chata
negativo,tosse custa crln consigo dormir
negativo,dormi chorando acordei raiva febre raiva
neutro,queria emocional atingisse corpo acabasse vontade comer sabe Seriaâ httpstcoxmVTElxbr8
neutro,porra braÃo dando febre
neutro,chorando agora febre U0001f97a fazer mandei fica calma
neutro,garganta febre sofro
neutro,porra febre
negativo,acordei bastante febre acreditando
neutro,cheguei escola tava febre
neutro,sair deixar bebÃ febre
negativo,novo febre aguento insistir amanhÃ noite
negativo,passar noite garganta febre ainda acordo consigo toma Ãgua beleza
positivo,desse lovizinho gostoso febre embora
neutro,nada manhÃ acordo morrendo corpo febre U0001f97a
negativo,febre caralho
negativo,fico puto termÃmetro medir febre
negativo,odeio febre intestino nenhum sintoma ficar boca fica umaâ httpstcooDr5OrgsaU
negativo,pirar filho queimando febre xadxadxadxadxad
negativo,febre noite estralando acorda trampa ouvir graca cedo toma
negativo,febre filha putaaaaaaaaaaaaaaaaaa
negativo,acordo corpo parecendo passou caminhÃo febre acompanha nBom
negativo,Lohan meses primeira nenÃm febre cabisbaixo pedaÃos
neutro,fiquei meses botar casa cheguei escola apontando coisa febre braco httpstcosGgIsqLoSR
neutro,febre madrugada parar queria ficar desse jeito U0001f97a
neutro,falando febre queimou neurÃnios errei portuguÃs hora dessas escreve certo auge sono kkkk
neutro,dormi nada noite ardendo febre liga
neutro,saco suando devia febre
negativo,febre vontade chorar odeio ficar doente
negativo,zuado passei folga inteira cima cama queimando febrenn comi todo tambÃmnnq Ãdio
negativo,cheio febre merda
neutro,amiga anos VINTE SEIS Covid falta febre corpo todo U0001f97a httpstco32OD8j9RDK
neutro,irmÃ acordou tomar remÃdio febre vomitando remÃdio
negativo,caralho mano vizinho manca TODO cedo fica corredor tosse fudida coloca mÃscarax8fu200¸x8f
neutro,levar amor emergÃncia hoje gripado asma passou noite toda cansaÃo nariz super httpstco2tyvydB7OQ
neutro,VocÃ tosse dopada coma hahahaha
neutro,horas comeÃa crise tosse dentro trem kkkkk povo jaja linchar daqui kkkk
neutro,ataco tosse consegui dormir direito desgraÃa
negativo,aguento tanta tosse falta
negativo,tosse arrombada dxou dormir noite toda
negativo,fiquei semana presencial morrendo falta binder
negativo,mano difÃxadciltava falta pÃnico chorando travado tipo braÃo relaÃwoâ httpstcop5cH9E1onH
negativo,consegui comer conseguindo dormir falta crise choro outras coisasnVai ansiedade come
negativo,ansioso Mano acordado desde manhÃ cÃrebro acho atrasadoâ httpstcoZ0YHoGzyjC
neutro,NenÃm deixa mamÃe mimi kkkkk muita falta
negativo,falta peito juntinho aguento
negativo,falta desgracada morre
negativo,Acordei falta
negativo,Acordei muita falta odeio
neutro,acordei falta fodida deus
negativo,vazioaquele sentimento culpaaquela falta aperto sozinhoacho perdi caos
negativo,caralho falta
negativo,falta acaba U0001f97a
negativo,falta insuporvel sentindo deixou dormir hora praticamente choraâ httpstcouyjFOzLeg3
negativo,falta irrita
negativo,krlh falta acabar matando
negativo,Falta caralho
negativo,falta caramba
negativo,cozinha beber remedio quase morri odio falta
negativo,indo tentar dormir 0420 manhÃ pouco falta deixando nervoso nenÃm precisando ajuda
negativo,consigo dormir muita falta
neutro,passando falta caralho
negativo,aguento tanta tosse falta
negativo,dormi ainda cara parece enfiando vÃrios cacos vidro corpo falta furiosa
negativo,dormi nada puta falta
neutro,cama consigo dormir consigo acordo assustada comigo falta U0001f97aU0001f97a
neutro,acordo humor theo acordar sendo cedo fico falta
negativo,puta falta tomara morra
negativo,falta carakho
neutro,falta sentindo puta pariuuu
neutro,creio febre
negativo,Lembra fiquei pior febre mano diarrÃia caralho
neutro,caceta acho febre
neutro,ardendo febre deus
neutro,Cara febre baixaaa
neutro,caralho tomar remÃdio febre suar tanto
positivo,febre valeu pena vamo
neutro,Mufina febre olhos” acreditando
negativo,azarado febre
negativo,falta commisso dessas sonsas realidade comparÃveâ httpstcou7foCDeXA6
negativo,cheio argumentos principal pessoas enviadas casa terem falta Voce httpstco7l0dHhNmqe
neutro,consigo chorar aperto peito falta
negativo,ansiedade matar falta manoo vida fode assim
negativo,tempo consigo dormi desconfio todos peito falta sensaÃÃo
positivo,adianta explicar quer ouvir tomei tomo quase vÃrias pessoas ficaâ httpstcopLcE9fNx4v
neutro,acho falta parece coraÃao preso caixa explicar deus
negativo,Aiii falta ar’essa porra
neutro,falta desde cedo
negativo,pesadelo parece acaba nunca xadxadxadxad voltou hospital Agora falta vÃxadrus httpstcomeprg1pIrk
negativo,dias falta toda antes dormir nebulizar aglomerando gente munâ httpstcoZSN12pCBbr
negativo,falta todo agora carai
neutro,realmente achando morrer posso sentar sofÃ falta
negativo,ensaio cedo graÃas falta madrugada toda pude porra ainda matar
neutro,falta poha
negativo,Falta puta cansado sentido nnpor favor agora
neutro,Falta fudida
neutro,Falta hoje passando limites
negativo,fica falta porra
neutro,manhÃ tava saindo bocae tarde acordei falta arquase morrendodia louco porra
neutro,indo hospital morrendo falta rezando
negativo,assustador hospital falta crise choro dentro sozinha quan httpstcohBUhiClVpX
neutro,falta parece alguem sentado peito consigo puxar direito morre
negativo,chorando telefone corpo falta causa covid acaba
negativo,falta matando poucos aqui nada galera
negativo,repente fiquei falta vtmnc
negativo,falta
negativo,falta morre
neutro,Vivendo eterno falta serÃ covid ansiedade desde marÃo 2020
neutro,dormir falta acordo falta assim segue todo Jesus
neutro,fecha algm tosse
negativo,triste Perdi amigo Longas longas conversas disse Covid tosse inconformado
negativo,crise tosse tudo precisava
negativo,detesto ficar tosse
negativo,tosse aguento
negativo,tosse matando
neutro,preocupada real ncamilla tosse seca todo Viih tube semana passada agoraâ httpstcofIVkkXmQ1I
negativo,Lindo tosse ficando paranÃica
negativo,Deus difÃxadcil segurar tosse
neutro,fessor tendo aula covid tendo crise tosse
negativo,aguento coriza tosse
negativo,aguento tosse satanÃs preciso voltar vida piranha novo
neutro,tosse carai
neutro,tosse esquisita medo real covid tomar antialÃrgico passar fodeu
neutro,todo vizinho passando puta tosse tuberculoso falta morrer sempre assusto kkkkk
negativo,Tosse chata
negativo,Tosse comeÃo garganta faltava
negativo,tosse seca chata
neutro,update jeto semana mencionei aqui sintomas leves tosse garganta coriza reporâ httpstcoeEYsJD4mdy
neutro,meses assim febre dormiu chorou tadinha
negativo,AÃxad vocÃ surtando acordo falando filha acordou febre corpo covid
positivo,Acordei felizona estudar febre
positivo,venceu febre passou
negativo,Davi febre acordando toda hora cansada
negativo,agora febre gente aqui casa pesado
negativo,sentindo infernal febre quero morre
neutro,febre tosse cansaÃo tomara aaaaaaaaa
negativo,horrores achei tava melhorando voltei febre todo tipo exausto trabalha httpstcoTIOZKbt6mN
negativo,Kkkkkkkk entendi alÃm psicolÃgico piorei velocidade desabafo febre deus httpstcouTXW64xfUA
negativo,tosse febre comprar remÃdio
neutro,febre
neutro,febre suando frio Deus
neutro,muita febre „xad
neutro,Sigo febre Ipanema peÃo teÃÃo
neutro,dando febre senhor
negativo,fudida acho acordei febre olfato diminuiu garganta ficou ruim NADA
negativo,menina aqui Ãnibus falando febre nela vacina carai tomo
positivo,Simmm aÃxad jornal passava povo tava sentindo falta AÃxad ficava SerÃâ httpstcol7GUHxJ2MT
neutro,sair plantas kkkkkkk hora parece falta
negativo,Nesse vÃxaddeo âpacienteâx9d falta Jamais algo HORRÃx8dVEL paganda httpstcokuzJ3q9rZZ
negativo,achando fobia social Toda pego onibus metro falta preso preciso psicologo
negativo,sentindo falta direto ansiedade desgraÃada mate logo
negativo,Ontem consigui crise disforia ansiedade depreso falta hiperatividade crise bizarra queâ httpstcomgLA4xVSaO
negativo,Trabalhar gente morta fome falta coisa nojenta existe raÃa maldita
neutro,sonhou espÃxadrito tentando sufocala realmente acordou falta arpqp
negativo,costas falta acho morrer verdade
negativo,caralho noite foda dormi quase nada falta
negativo,Falta lixo
negativo,falta espero morra
neutro,Falta
neutro,Fiquei falta plmds
negativo,momento chorar falta
negativo,mÃdico nega ambulÃncia irmÃo diarrÃia febre abdominal FALTA httpstcoi9Dln8OO8V
negativo,Ãtimo indo hospital falta indo levar inferno
neutro,imaginar daqui pouco comeÃa falta vontade chorar
neutro,romantiza ansiedade nunca passou noite inteira dormir chorando falta cansaÃo desgraÃado crise
negativo,muita falta ultimamente medo
negativo,menina sala falta deus ainda casa
neutro,barriga atrÃs olhos falta feia dormi espera
negativo,todo negÃcio acordar morrendo falta Ãdio merda caralho
negativo,inexplicÃvel falta
positivo,24horas filaâ httpstcouRof6c5KU9
positivo,brasileirinhos exame Covid 1nSei falso outro vÃxadrus maluco httpstcoZSYjJeGEYF
neutro,Cada tosse escutada oraÃÃo diferente
neutro,camilla thais tosse caio carla sentir gosto coisas viih tube gargantaarthur httpstcotN5Dk5cxut
neutro,Carla Diaz sentir gosto cheironCaio sentir gosto quebradonCamilla Lucas tosse seca nThais httpstcoyIOS8upIxu
neutro,Melhor coisa muita mÃdica passou xarope tosse fazia dormir httpstcorhr39X09EP
negativo,Sonhando aguento tosse entrar PÃnico
negativo,tosse pneumologista pede tomografia retorno httpstcos6Be9069NE
negativo,Aconteceu temia crise tosse Ãnibus queria morrer xadx8fu200¸x8fxadx8fu200¸x8fxadx8fu200¸x8f
negativo,dormir cedo lembro tosse tentar engolir formava boca pensava perdeâ httpstcoAvgO2HE28X
neutro,febre tosse cansaÃo tomara aaaaaaaaa
positivo,Finalmente tosse seca expectorando
negativo,preguei olho noite tosse infernos
negativo,odiar tossir frente outros trabalho ataca tosse inferno
neutro,tosse coriza garganta febre covid todo caso dado temâ httpstcot4VPKLzX1i
neutro,tosse infernos Brasil
neutro,Rezem ClÃo internada ontem noite dificuldade respirar tosse cachorro
negativo,separando alas suspeito covid consulta normal igual bosta velhonnse pego merdaâ httpstcohXGLkGK5Mg
negativo,tosse desgraÃa medo covid
neutro,crise tosse chega engasguei kkkkk mulher saiu lado
negativo,tosse pulmÃo serio dormir hoje
neutro,tosse desgraÃaaaaaa
neutro,tosse caralho embora
negativo,tosse terrÃxadvel peito costas pulmÃozinho incomode novamente afim ficar httpstcof3TaG3KETN
negativo,tosse normal loco
negativo,tipo idiota pensam morre todo santo 1000 pessoas doenÃaâ httpstcoAhMHk34An0
neutro,Deus cÃunChuva intensanEu mundonSem noxadciasnVai dando falta
negativo,ansiedade falta crlh
negativo,ansiedade esmago barriga falta peito Jesus causa
negativo,tantas manotas deste desGoverno superei fase vergonha alheia raiâ httpstcoUNA6lqESAK
neutro,Espero falta asma covid ferrada
neutro,falta ansiedade ataca
neutro,Deus acordei falta
neutro,amado falta
negativo,Passei madrugada falta Acho hora chegando
neutro,falta DeusnParece morrer
negativo,paladar tosse dias casa vigiada Brasil Globolixo fala tanto gente ficar httpstcoMB9VEsQw0d
negativo,Ãdio desse imbecil porra NUNCA tiro mÃscara idiota veio bebendo agua httpstco0W8aZDFdGf
neutro,melhorando acho Ainda recuperaram olfato paladar tosse seca httpstcofm7nS1ZokY
negativo,sensaÃÃo garganta ruim tosse fodida dias httpstco6ZuogmpCB5
neutro,Caralho crise tosse agora
negativo,tosse passa raiva
neutro,refluxo sinto comer vontade vomitar junto tosse soluÃo insuporveâ httpstcoTTUHYpKwhg
negativo,acordou tosse Deus corona pfvv
neutro,Poxa preocupado acesso tosse agora manhÃ coceira garganta atento verâ httpstcoXScSEbKKYA
negativo,tosse chata mano
negativo,vergonha cara fica onde Conseguiram eliminar sarampo febre amarela dengue hepatite httpstcoIjkZ5XDh9i
positivo,alÃxadvio contente febre menos corona kkkkk
neutro,deus todas amigas garganta febre
neutro,Acho dando febre causa porra poeira
positivo,acordei parecendo levei soco olho tanto doendo maos juntas pÃsnnmassshttpstcoSKIhNAHvML
negativo,sair casa pode sair farmÃcia hospital farmÃcia estar httpstcoHkUMt6gdWZ
neutro,arthur dormiu aqui queimando febre
negativo,davi acordou febre aperta logo
negativo,apetite algum febre dores corpo latejando medo alguma coisa acabaâ httpstcoYTfSLeEqlC
neutro,febre favor embora
negativo,Gente semana inhaca todo lado febre cÃlica siso todo zoado crise enxaqueca toma
negativo,Mano medo quero morrer nnGalera orem dias seguidos febre alta olhos httpstco3S4ic2SQv8
neutro,medo estar febre noÃÃo
neutro,passou madrigada toda febre”¬
negativo,Passei noite toda febre medo
negativo,piorar tudo ainda febre
negativo,tosse raiva homem maldito
negativo,serio tava comeÃou esfergar falando tomara pegue gripe contaâ httpstcom1T0ut6gJ3
positivo,tosse dando trÃgua finalmente caralho
negativo,aÃxad acordei agora tosse tudo conta desse caralho mudanÃa tempo
neutro,Dani cheio tosse tadinho
negativo,Foda tosse gripe pandemia quer expirar tossir pulmÃµes pessoas ficam httpstco9CtteSQEXl
positivo,Ontem terminei corticoide hoje termino antibiÃtico sentindo melhor comparaÃÃonnMaâ httpstcogF14yxY4zq
negativo,merda pneumonia deixa mano aguento tosse raivaaaa
negativo,tosse desgraÃada consegui dormir direito
negativo,Tosse
negativo,Ruim jornalzinho merdas ministro certeza muita culpa nisto tudo pois httpstcokocH2Rv2ks
negativo,fico triste envergonhado noxadcias outros estados aqui Paulo httpstcoiLcP3CmleD
negativo,Ouvir reportagens covid cedo falta
negativo,centro agora manhÃ nada comeÃou medo comum falta bizarra httpstcoBAYWbumx0y
negativo,Pergunta Mandetta porque tocolo cure mÃdico somente sentir falta httpstco8N0s3XKqwS
negativo,Mandetta nunciamento naÃÃo pediu brasileiros curassem ajuda mÃdica somente httpstcovhfOLM1YdU
negativo,Muitas pessoas perderam vida confiar cidao recomendou curar hospital somenteâ httpstco9mTOF1Wmet
negativo,imbecil recomendava curasse mÃdico sentisse falta
negativo,Falou imbecil fica casa sentir falta
negativo,Falou rapaz mandou hospital falta festinha mÃscara
neutro,impressionante doenÃa afeta tudo tosse desestabiliza corpo fÃxadsico falta httpstcom33bK6Gean
negativo,Acordei falta devo preocupar
negativo,Acordei falta bombinha achei asma continua jeito Agora preocupada
negativo,falta acho deus
negativo,falta fudidaaa
negativo,Odeio acordar falta
negativo,ontem hoje falta saco sinceramente
negativo,falta
negativo,todo acordo hora porque cismo falta covid deus aguento
negativo,alegria pobre dura pouconOntem recheado alegria alÃxadvio estar vacinada puta odioâ httpstcoQWdcrSP3rl
negativo,gripezinha pqpnEu treconMuita febre muita cansaÃoâ httpstcoXxffXAhsJ6
negativo,Amiga chegou febre postinho MÃdico vagabundo corrupto tacou suspeita covid mandou isolar httpstcomHl2ldG80i
negativo,Desde anteontem febre disposiÃÃo
positivo,passamos margem febre intensos dias
negativo,Febre dormi choro ainda
negativo,pobre amanhecer febre
negativo,ontem noite quase morri febre
negativo,arrumei escola febre passa aguento
negativo,aguento acordar febre
negativo,consegui dormir cheia febre tendo pesadelos horrÃxadveis
negativo,posso conversar abraÃar ninguÃm porque fico silÃncio consigo httpstcobgkQHR8jCp
negativo,Queimei febre noite inteira acabei levantar morrendoela perguntou ainda quer cobrar coisas mimaff
negativo,viajando maluco porra prudente sofisticada comeu manga febre
negativo,Prescrevendo onde mÃdicos prescrevâ httpstco6gJkuq7nvd
negativo,entendo porque entrevistar cara deveria incriminado ohttpstcoXpoLUBDwdQ
negativo,FamÃxadlia amigos Covid leitos Pirapora Jesus muita febre fracos DoenÃa podemos ajudar
positivo,quero avisar melhorzinho graÃas febre sendo controladahttpstcoiUOhJA8DRT
positivo,quadro clÃxadnico esvel febre oxigÃnio baixo fluxo nenhum outro sintoma relevante assiâ httpstcowf7Gvhgzxy
negativo,febre trem satanÃs
negativo,Hoje tristeza passageiranHoje fiquei febre tarde inteiranE chegar noite cada estrela parecerÃ lÃgrima
negativo,basta febre horas garganta doendo tanto consigo comertomar nada raiva
positivo,MamÃe esvel saturaÃÃo normal febre orientadanAinda precisa suporte oxigÃnionO sinal httpstcowpgQGkBTIJ
negativo,bebÃ acordou febre
negativo,febre preso baixa
negativo,terceiro acordo febre acontecendo comigo
negativo,queimando febre nada
negativo,mocinha acha graÃa mÃdicos linha frente usam mÃscara inteiro inÃxadcioâ httpstcolvGBwVp5Aj
negativo,Assim mÃdicos compencia pouco commisso vida fala existe httpstcoPr3FSF1ahL
negativo,sinto fase difÃxadcil guerra enfermeira hospital lotado RSnn‰ falta httpstcofZBI6go9wk
negativo,acordei falta porque sonhei contexto pandemia tava todo mundo aglomerado lugar fechado mÃscara agonia
negativo,sintomas covid precisei consultar fazer exame fiquei assustado emocâ httpstcoE8oml2EjRM
negativo,hoje foda acordei vÃrias vezes falta fiquei paralisia todas vezes tentei dormir novo agora chorando
negativo,falta
negativo,Cuba pacientes precisam levar comida casa hospitalâ pagar tratamento internaÃâ httpstcoaolf071EON
negativo,Pois nobro aqui Alemanha nenhum remÃdio exceâ httpstcowBeS8k0jJu
positivo,Renato fase tomando ivermectina azitromicina zinco sentindoâ httpstcoDJlvzQFEi6
negativo,sintoma acordeipior muita tosse peito pesado febre preocupada
negativo,acordei tosse
negativo,internado Nunca desperador naquele estado cansaÃo tosse persistente tiraâ httpstcossJ7FLBLPJ
negativo,Caralho tosse insuporvel
negativo,tosse voltando FUDEEER GRIPE MERDAAAAA
negativo,amado tosse peste essaaaaaa
neutro,NebulizacÃo entupindo remÃdio nada tosse gripe passar porra corona
neutro,caso tosse velha afogo saliva caso espirro puramente alergico inferno
neutro,nada fico gripado merda cheio tosse
neutro,tosse
negativo,pensar dormir tosse desgraÃada
neutro,Sabe tosse Ãnsia Pois
negativo,tosse caralho
negativo,QUERO PESSOAS MORRAM LIGO DINHEIR9 VENHAM DIZER PASSA ARROGANCIAâ httpstcovyycdGs5lG
neutro,VocÃ covarde carÃter cesseme tosse
neutro,ainda tosse cima outros pragas
neutro,Caralho tabagismo nnFui risada tosse fumante cinco minutos
neutro,COVID congeso nasal TaÃxad caso marido tosse seca deixou cismada
neutro,Receita dada conforme sintomas Covid doenÃa sismica receiâ httpstco57F1HO00My
neutro,acho tosse medo
neutro,noite covid semana hoje hospital febre tosse reagir âx8f
neutro,tosse cachorro foda
neutro,tosse nunca embora Ãdio
neutro,mano tosse porra
negativo,aguento ficar casa mano vtmnc tosse desgraÃada
negativo,nojo tosse seca nunca passa
negativo,medo tosse
negativo,tosse chataaaa
neutro,Segunda semana contando desde gripei tosse ainda embora vezes chego sentir leve gohttpstcoFuHaua3SME
neutro,dando pena bichinho tosse
neutro,ficando preocupada tosse corona graÃa
negativo,Tosse fudida aguento
negativo,mano aguento falta
negativo,doenÃa respiraria merda fazendo nebulizaÃÃo morre falta
neutro,falta vontade chorar
positivo,lindo artistas idosos vacinando sensaÃÃo viver passar horror httpstcoCcpDjXDuUL
negativo,seinncomo tratamento precoce prejudicasse prÃximas fases tratamentonn RETARDADOS preferâ httpstco1veap6S9lP
negativo,pprt mano ontem merda cara vsfd passei inteiro vomitando febre jurei tava covid
neutro,KKKKKKKKKKKK medo causa coronansempre espera delirar febrâ httpstco72J1XSOWLz
neutro,estar febre
neutro,febre estar Elly
neutro,caraca febre
neutro,HelÃ pizzaria aqui sofÃ queimando febre comendo banana kkkkkkkkkkk aÃxad
neutro,filho febre fica pequenininho
neutro,minh diss febre x8dx8fx8dx8fx8dx8fx8dx8fx8dx8fx8dx8fx8dx8f
neutro,febre chorar
negativo,absurdo filas espera mÃdicos queimando febre lugar hora httpstcoUF9nQFmaqN
negativo,Segunda febre odioooor
negativo,febre inferno odio
neutro,HAHAHA âx9d¸x8fnconsigo ouvir tosse daqui
neutro,contando tomei querosene aÃucar curar tosse fessor ficando preocupadoKKKKKKKKKKKKnnNâ httpstcohHiJBoD3IQ
negativo,alguÃm adoece mÃdico imediatamente medicado pessoa febre tosse httpstcoj0fdpZwr1J
neutro,tosse fumante passa nunca
neutro,Ãtimo puta crise tosse alÃrgica causa mudanÃas tempo covid
neutro,febre tosse vezes assustam
neutro,Acordei tosse aqui irmÃo deixou cabelos assustado
negativo,kkkk tosse chata CaraÃxad SaÃxad nada nessa porra pareÃo cachorro doente
neutro,crise tosse putaqpariu
negativo,porra tosse tirou dormi merda nenhuma
negativo,COVID acabando gente Franciel queimando febre explodindo tanta Conradoâ httpstcowzgXNyGloE
neutro,falando irmÃ tosse pouco seca nnnojento menos covid
negativo,HelloÃ tosse crlh saco
neutro,completo semana afastamento conta covid Acordei suando tosse vomito medo pior httpstcoxwLpqZqtAL
negativo,hoje tosse comum aguento
negativo,tosse
negativo,deus Ãdio tosse
neutro,irmÃo chega mÃdico tosse cachorro KKKKK mÃdio aguentou comeÃou kkkkkkkkkkkkkkk
neutro,Mirela tosse seca Coitada
neutro,aguento tosse velho
neutro,ninha fessora matemÃtica crise tosse minnnta covid porra
negativo,tosse desgraÃada parece cuspir pulmÃo cara locura
neutro,tosse chata
neutro,tanta tosse rouca
neutro,tosse chata
neutro,tosse chataa
negativo,Tosse demÃnio
neutro,Nunca pensei ficaria doente febre conta ansiedade
neutro,Pegou COVID febre
negativo,Imaginem entres queridos sendo jogado vala comum gado quandoâ httpstcoyBBitnMPXE
negativo,passar delÃxadrio noite febre assim superar tombo
negativo,trabalha filha pouco febre menina toma conta disse elaâ httpstcoMpyV3ikFsX
positivo,lindona nEstou febre nObrigada
negativo,febre tosse vezes assustam
negativo,Acordei febre gripe fodidaque Ãdio
negativo,gargantade febre fraqueza merda essaxad
negativo,febre baixa nunca deixa ruim
negativo,chorando filha reclamando febre fica pequenininho
negativo,Mano nunca tanto medo febre
positivo,passou madrugada toda vendo febre companheira âx9d¸x8fâx9d¸x8f
positivo,ohmds postei negocio febre emille mandou coisas ajudam melhorar nunca httpstco0DInmkFfNZ
neutro,fiquei febre tanto chorar assim
neutro,febre tanto chorei kkkjj
negativo,graus tremendo frio nada tava febre estado fabril agora surtoâ httpstcoQVjYLDefag
neutro,cÃlica febre
positivo,adeÃo Deus veio sintomas fortes merda COVID somente tosse boca esmagoâ httpstcoplMlRXWaOp
negativo,febre triste x8d·
neutro,febre odeio ficar assim
negativo,queimando febre nmaravilha
negativo,triste querendo morte febre
neutro,lais falando gostar ficar febreÂ¿ doente
neutro,comeÃou febre
neutro,deus febre
neutro,porra bixo dando febre
neutro,diria pescoÃo foda iria render dois dias febre
negativo,Saiu casa buscar outros tava passando comu dipirona febre
negativo,febre novo merda
neutro,febre
negativo,Toda noite fico olhos sensaÃÃo febre aguento
neutro,corporesfriada febre Jesus
neutro,Kkkkkk preconceito velhinha tosse
neutro,pessoas tentando alertar sobre prevenÃÃo covid19 ficando ansiosa Culpa Milena httpstcon0Vf9BalYv
negativo,merda comendo forÃa Ãdio tosse piora
negativo,sincera piorando antes tava tosse agora
neutro,tosse estranha medo vocÃs afastarem mimâx9d kkkkkkkkkkkkkkkkkkkkkk
negativo,raiva dessas crises tosse noturnas
negativo,chegar hora dormir tosse comeÃa
negativo,Caralho nada tosse fuder quarto parece jogam terra nele todo
negativo,caralho tosse alÃrgica desgracias
negativo,tosse mandada mano doido
neutro,tosse corpo febre gente Serasse covid xad¯
negativo,dizendo quer leve atestado fÃbrica levar merda nenhuma filâ httpstcoER9FqmRhHe
neutro,tosse
negativo,Foda tosse httpstcoQILM9GmaFD
negativo,GENTE XAROPE TOSSE HORRÃx8dVEL DEUS ÃDIOOOOOOOOOOO
negativo,coroa mandou Biel subir aqui fumando foda preciso desfocar tosse pouco garganta
negativo,Mdssssss tosse nunca louco
negativo,aguento tosse
neutro,tosse chata nCorona favor aqui
negativo,Poha tosse manooooooo aguento maaaiiiiiisssss aaaaaaaaaaa
neutro,bastasse espirrar toda hora tosse voltou deus
negativo,Todo noite tosse infernal
neutro,Tosse seca pior tosse discorda morre
negativo,compreendo anjinho gente acostuma dentro aperta falta httpstcolUF9RhtxXq
negativo,Ansiedade frescura falta Deus doenÃa falta pÃnico tremedeira alucinaÃÃo httpstco2L8p3zDGt3
negativo,tendo gatilho hospital camas hospital gente falta gente morrendo tudo httpstcoGwPQ39BMd4
negativo,horas ansiedade deixa falta parece morrer
negativo,terra dentro Mandetta sacanagem Fique casa sentirâ httpstcoFqrtDEKfz2
negativo,falta
negativo,triste carannpior umas infecÃÃµes corpo sistema imunolÃgico todoâ httpstcoS3yILfezte
neutro,acordei falta novo olha
negativo,Dores doendo falta crises choro httpstcoZXmFDrRowR
neutro,peito leve falta covid duÃÃo
negativo,ando sentindo muita falta falar acho conhecer deus daqui dias
negativo,seiose falta quero mÃdico Sangue maldito acaba vida httpstcoqvyMRMFb1p
negativo,odeio falta passa nada volta
negativo,falta nada odio
negativo,falta cacete
negativo,falta arao tempo frio suandoum aperto noite
negativo,pais fudendo falta pais preocupados vocÃ httpstcoBn0xJ16p90
negativo,falta senhor
